[
  {
    "schema_version": "1.0.0",
    "county_fips": "51059",
    "county_name": "Fairfax County",
    "state_abbr": "VA",
    "as_of_year": 2026,
    "facility_exposure": {
      "operating_count": 0,
      "proposed_count": 0,
      "cancelled_or_rejected_count": 0
    },
    "indices": {
      "DCEDI": {"status": "not_applicable"},
      "DCOI": {"status": "insufficient_data"},
      "DCCCI": {"status": "insufficient_data"}
    },
    "quality": {"data_quality_grade": "P", "model_confidence_grade": "P", "component_coverage": 0},
    "data_version": "2026-08-31+fixture",
    "model_versions": [],
    "generated_at": "2026-08-31T13:05:00-04:00"
  },
  {
    "schema_version": "1.0.0",
    "county_fips": "51107",
    "county_name": "Loudoun County",
    "state_abbr": "VA",
    "as_of_year": 2026,
    "facility_exposure": {
      "operating_count": 1,
      "proposed_count": 0,
      "cancelled_or_rejected_count": 0,
      "first_operational_year": 2014,
      "last_major_expansion_year": 2020,
      "operational_mw_observed": 48,
      "operational_mw_coverage": 0.8
    },
    "indices": {
      "DCEDI": {"score": 57.4, "ci_low": 42.1, "ci_high": 69.8, "coverage": 0.65, "status": "provisional", "index_score_id": "idx_00000001"},
      "DCOI": {"status": "insufficient_data"},
      "DCCCI": {"status": "insufficient_data"}
    },
    "quality": {"data_quality_grade": "B", "model_confidence_grade": "C", "component_coverage": 0.65},
    "data_version": "2026-08-31+fixture",
    "model_versions": ["run_00000001"],
    "generated_at": "2026-08-31T13:05:00-04:00"
  }
]
